{
  "version": "1.0.0",
  "published_at": "2025-11-19T10:00:00Z",
  "repository": "https://github.com/nigelgwork/ignition-playground",
  "playbooks": {
    "gateway/module_upgrade": {
      "version": "4.1",
      "domain": "gateway",
      "verified": true,
      "verified_by": "Nigel G",
      "verified_at": "2025-11-19T10:00:00Z",
      "description": "Upgrade Ignition modules with rollback support and signed/unsigned preference",
      "download_url": "https://github.com/nigelgwork/ignition-playground/releases/download/playbooks-v1.0.0/gateway-module_upgrade-4.1.yaml",
      "checksum": "sha256:abc123def456...",
      "size_bytes": 8542,
      "dependencies": [],
      "author": "Ignition Automation Toolkit",
      "tags": ["gateway", "modules", "upgrade"],
      "group": "Gateway (Advanced)",
      "release_notes": "Added prefer_unsigned parameter for module signature selection"
    },
    "gateway/module_install": {
      "version": "4.1",
      "domain": "gateway",
      "verified": true,
      "verified_by": "Nigel G",
      "verified_at": "2025-11-19T10:00:00Z",
      "description": "Install Ignition modules with automatic status monitoring",
      "download_url": "https://github.com/nigelgwork/ignition-playground/releases/download/playbooks-v1.0.0/gateway-module_install-4.1.yaml",
      "checksum": "sha256:def789abc123...",
      "size_bytes": 7234,
      "dependencies": [],
      "author": "Ignition Automation Toolkit",
      "tags": ["gateway", "modules", "install"],
      "group": "Gateway (Advanced)",
      "release_notes": "Added prefer_unsigned parameter for module signature selection"
    },
    "gateway/module_uninstall": {
      "version": "2.0",
      "domain": "gateway",
      "verified": true,
      "verified_by": "Nigel G",
      "verified_at": "2025-11-19T10:00:00Z",
      "description": "Uninstall Ignition modules by module ID",
      "download_url": "https://github.com/nigelgwork/ignition-playground/releases/download/playbooks-v1.0.0/gateway-module_uninstall-2.0.yaml",
      "checksum": "sha256:789def456abc...",
      "size_bytes": 4521,
      "dependencies": [],
      "author": "Ignition Automation Toolkit",
      "tags": ["gateway", "modules", "uninstall"],
      "group": "Gateway (Advanced)"
    },
    "gateway/backup_gateway": {
      "version": "2.0",
      "domain": "gateway",
      "verified": true,
      "verified_by": "Nigel G",
      "verified_at": "2025-11-19T10:00:00Z",
      "description": "Create a full Gateway backup via REST API",
      "download_url": "https://github.com/nigelgwork/ignition-playground/releases/download/playbooks-v1.0.0/gateway-backup_gateway-2.0.yaml",
      "checksum": "sha256:456abc789def...",
      "size_bytes": 3892,
      "dependencies": ["gateway/gateway_login"],
      "author": "Ignition Automation Toolkit",
      "tags": ["gateway", "backup", "maintenance"],
      "group": "Gateway (Advanced)"
    },
    "gateway/list_projects": {
      "version": "2.0",
      "domain": "gateway",
      "verified": true,
      "verified_by": "Nigel G",
      "verified_at": "2025-11-19T10:00:00Z",
      "description": "List all Perspective projects from Gateway",
      "download_url": "https://github.com/nigelgwork/ignition-playground/releases/download/playbooks-v1.0.0/gateway-list_projects-2.0.yaml",
      "checksum": "sha256:321fed654cba...",
      "size_bytes": 2987,
      "dependencies": ["gateway/gateway_login"],
      "author": "Ignition Automation Toolkit",
      "tags": ["gateway", "projects", "info"],
      "group": "Gateway (Advanced)"
    },
    "perspective/button_test": {
      "version": "3.0",
      "domain": "perspective",
      "verified": true,
      "verified_by": "Nigel G",
      "verified_at": "2025-11-19T10:00:00Z",
      "description": "Test Perspective button components with click simulation and verification",
      "download_url": "https://github.com/nigelgwork/ignition-playground/releases/download/playbooks-v1.0.0/perspective-button_test-3.0.yaml",
      "checksum": "sha256:654cba321fed...",
      "size_bytes": 5432,
      "dependencies": [],
      "author": "Ignition Automation Toolkit",
      "tags": ["perspective", "buttons", "testing", "ui"],
      "group": "Perspective (Components)"
    },
    "perspective/input_validation": {
      "version": "2.0",
      "domain": "perspective",
      "verified": true,
      "verified_by": "Nigel G",
      "verified_at": "2025-11-19T10:00:00Z",
      "description": "Validate text input fields with various test cases",
      "download_url": "https://github.com/nigelgwork/ignition-playground/releases/download/playbooks-v1.0.0/perspective-input_validation-2.0.yaml",
      "checksum": "sha256:fed654cba321...",
      "size_bytes": 6123,
      "dependencies": [],
      "author": "Ignition Automation Toolkit",
      "tags": ["perspective", "input", "validation", "testing"],
      "group": "Perspective (Components)"
    },
    "perspective/navigation_test": {
      "version": "2.0",
      "domain": "perspective",
      "verified": true,
      "verified_by": "Nigel G",
      "verified_at": "2025-11-19T10:00:00Z",
      "description": "Test page navigation and URL parameters in Perspective",
      "download_url": "https://github.com/nigelgwork/ignition-playground/releases/download/playbooks-v1.0.0/perspective-navigation_test-2.0.yaml",
      "checksum": "sha256:cba321fed654...",
      "size_bytes": 4765,
      "dependencies": [],
      "author": "Ignition Automation Toolkit",
      "tags": ["perspective", "navigation", "testing"],
      "group": "Perspective (Navigation)"
    }
  }
}
